评论,时间,点赞数,标签
这不比手工梗要有趣[辣眼睛],2022-06-18 00:43:24,3,0
怎么感觉像是长了胡子的女人呢？,2022-06-18 01:10:00,3,0
哦，这蝎子原来是他做的。,2022-09-04 12:08:59,1,0
压力给到义乌这边[脱单doge][脱单doge][脱单doge],2022-07-13 15:30:11,1,0
哪里可以买到呢,2022-07-11 14:37:03,1,0
为什么我会想到电锯惊魂@is糖眠,2022-07-10 11:14:29,1,0
觉得这东西完全可以cos异形或者铁血,2022-07-10 08:29:18,1,0
漫展做核酸[doge][doge],2022-07-09 06:56:07,1,0
救命，跟怪形前传的手工一样,2022-07-08 14:57:10,1,0
哇@二六三一五,2022-07-08 10:41:02,1,0
蝎子太帅了,2022-07-08 00:59:11,1,0
好酷，感觉真的好适合做一些cos或者别的摄影作品之类的，超帅。要是专门搞个博物馆什么的展览我高低得去看看，太帅了这个。,2022-07-05 16:58:12,1,0
开幕雷击，吓我一大跳[辣眼睛],2022-07-04 12:36:32,1,0
那个蝎子戒指网上有卖的兄弟们冲,2022-07-04 11:45:55,1,0
哪天胖了一点，夹一下疼死,2022-07-04 09:57:38,1,0
让我想起铁血战士[呲牙],2022-07-03 07:08:18,1,0
不可名状,2022-07-03 05:30:03,1,0
@Silverbirds,2022-07-03 03:45:33,1,0
一进来我以为是生化僵尸,2022-07-02 09:50:08,1,0
@-丟_,2022-07-02 04:50:14,1,0
笑死了,2022-07-10 16:49:25,0,0
那个蝎子戒指我看到过感觉好酷[星星眼],2022-07-02 05:21:25,0,0
