评论,时间,点赞数,标签
很多都是现有技术的整合，但是整合出了一个大招,2023-03-23 16:11:02,3,0
想知道这个可以试用了吗，本打工人这个周末有事儿干了,2023-03-24 05:48:48,2,0
ai生成图不再是魔法召唤，全过程随机，而是全过程可把控,2023-03-22 22:23:41,14,0
反正里面用户协议也增加用这个作图默认被PS拿去炼，版权混乱时代要来临咯[doge],2023-03-23 00:33:22,14,0
这东西以后用的地方太多了，但是现在算力严重不足,2023-03-23 08:46:33,4,0
你们学了麻烦用对行业，别卷死自己了，还害了其它行业，工资还越来越低。设计师都拿着文员的工资。不就是打印机吗？,2023-03-25 00:51:18,1,0
"在18岁高考完选专业时，绝对不要想：“选什么职业都一样，反正行行出状元”
每个行业都能出个天花板，关状元之外的人没什么事 （就是职业之间根本不平等，比如疫情下的旅游）

能坚持下去的只有两个原因，两个都没有就毕业即转行了

1.用爱发电，如游戏开发
2.报酬高，如警察、卷烟厂

不推荐因为想学什么而选专业，或者我高考英语分数高所以我选这专业，而是因为工作而选专业
爱好现在就能做，并不是选了这个专业才能做（比如日语，绝不推荐日语当职业）

某个工作要这个专业，所以我选这个专业 √
我选这个专业，因为这个专业好！X

如某人想当工程师
逛了下招聘网，发现其要求为：计算机，XX六级
然后才开始根据该职业要求选专业

比如电竞， 官方举办比赛，比赛有奖金，为了图奖金才有人电竞，看到有人想图奖金就有人收学费教电竞，这就是行业的发展了
是我要奖金才电竞，而不是被别人教电竞好

如果察觉到自己“我好像喜欢XX”
没搞清就选的话，你喜欢的不是那个职业，而是你想象中的那个职业

看到个专业【游戏艺术设计】，想学游戏策划，结果重点是艺术，是一个天天画素描写真的美术专业

解决方法：
1.找该专业课程表，看【慕课】的网课体验下

2.招聘网看待遇要求【如某职业直接不招男/女，且看要求也能找方向专精】 （工地不招女生，那为啥土木招女生）

3.问已经上班的上班族，【一定要多问，两眼不闻窗外事是绝对错的】

4.豆瓣的后悔小语种小组等

如果是因为分数要求低或者父母选的专业，也是毕业即转行 

（为了上好学校选了个垃圾专业，花了四年时间，最后一看，转行了，但是学历提升了（比如因为分数要求低选电商）

大学最大的缺点就是培养多面手，考完就忘，工作一天能顶学校一年
一年时间学了四个，就算每天都学，平均下来每个也就学了三个月
结果只用到了其中一个，还不如专精学四个月的

【唯一的解决方法就是实习，最好大一就实习，这样就知道自己要干什么了】
如编程，是选择电脑还是手机？网页还是软件？

疫情和双减之后，不推荐【文科】和【艺术】，主要是【师范历史旅游英语日语服装设计产品动漫社会学管理电商新传】【理科不推荐：生化环材食品心理学农学药学游戏】
以及任何在被撤销的专业",2023-03-23 12:42:10,5,0
又一次被美国降维打击了，道阻且长啊,2023-03-23 14:53:06,2,0
以后显卡就是硬通货了,2023-03-23 14:59:24,4,0
如果大家都用同一套Ai方案，生成出来的图不会雷同吗？设计的版权呢？,2023-03-24 12:03:32,1,0
我周围学画画的一点也不急，或许都是大佬，有硬实力创新强的不会急，基础不牢的可能就要转行和别人抢工作了，刷到好几个画师考了会计证[思考],2023-03-23 20:56:59,1,0
在好的东西也是工具 人的思想是无法替代的!  思路是无法替代的 !,2023-03-26 01:28:05,0,0
低级劳动早就应该由机器取代了，办公室劳工少一些，人多做一些有创造性的工作，生产力才能提高，难不成发达国家之路是靠找office模板，排版编辑走出来的？不过我估摸着ai在中国要铺开阻力有点大，真要这样今后我们和发达国家的差距会越来越大,2023-03-22 20:44:40,21,0
重点是要和mj一样细节毫无破绽，之前adobe所谓的重磅自动抠图用起来真的就和名字一样a逗比，我还是觉得术业有专攻,2023-03-25 00:55:43,0,0
这下好了，都不用在卷了。无良老板希望员工的卷的世界到头了,2023-03-24 13:21:32,0,0
早点学会，早卷死同行,2023-03-23 02:42:21,16,0
这才是符合大部分设计师习惯的ai，所见即所得,2023-03-23 01:03:34,6,0
等个一键生成全套电商图[doge]我就失业力,2023-03-23 04:17:53,9,0
@阿屎1998 科技发展得真快啊！！,2023-03-25 05:19:08,0,0
这个只是概念宣传片，实际运用还不知猴年马月。[藏狐]我不管，一定是这样的！！,2023-03-23 03:23:56,7,0
这个不侵权吧，属于代替重复劳动了，还是创造性比较关键,2023-03-25 05:02:16,0,0
降维打击不至于，落后是肯定落后的，但差距不会比新中国刚成立时和美国的差距大,2023-03-23 17:52:38,1,0
回复 @红黑色的剑条衫 :不过感觉差距相比前些年又开始拉大了，他们的ai是以可见的速度发展起来了，知名的就有有chatgpt、novelAI，国内目前只有一个半吊子的文心一言和他的松鼠撅鱼,2023-03-24 18:06:07,0,0
我看以后只画画没啥用，得更升一级，会讲故事什么的,2023-03-23 21:53:53,0,0
我急了[囧]能力不是顶尖的就只能尽力接触这些东西了，但这些东西真没啥门槛，novelai有台显存好点的电脑，会打字用翻译软件翻译成英文就能用了，chatgpt更是傻瓜式(要不是国内目前用不上,2023-03-24 18:12:40,1,0
回复 @混乱chaos :最好一边学AI一边学点别的东西，如果能力不是特别出众死吊在商业美术上不是好选择，艺术类其实也可以干别的，服装设计还有室内设计，这些AI暂时还比较远。服装设计看似AI能取代，但实际操作的时候并不能取代，因为服装设计师不仅要设计还要通打板和布料缝纫，这些都涉及手工和人力判断。以后艺术类的都要加入思考才能立于不败之地。,2023-03-24 22:21:02,0,0
你所说的低级劳动人数还是蛮多的，被取代之后你总得给人家一个饭碗啊，创造力这东西，不关低级劳动人群的事啊,2023-03-22 21:20:47,33,0
回复 @is战斗民族灵 :设计的上限是甲方审美，甲方不会自己操作软件，那么操作软件的人就能省出大量时间摸鱼[doge],2023-03-22 23:28:20,6,0
读书读傻了[大笑][大笑],2023-03-23 00:15:56,15,0
不用卷了，因为有些人要直接失业了[囧],2023-03-24 18:20:52,0,0
同行会用低工资来卷你的。[doge],2023-03-23 15:05:48,4,0
[doge]不要再欺骗自己,2023-03-24 02:16:27,0,0
up有ai 3d建模的信息吗？我觉得下一个应该是这玩意了。,2023-03-22 15:08:37,1,0
回复 @Miracle诺言 :有的，不少论文demo已经上3D了，我后面会分享[呲牙],2023-03-22 16:27:41,4,0
回复 @Miracle诺言 :英伟达昨天说他要做,2023-03-23 03:52:01,1,0
up有ai 3d建模的信息吗？我觉得下一个应该是这玩意了。,2023-03-22 15:08:37,1,0
回复 @Miracle诺言 :有的，不少论文demo已经上3D了，我后面会分享[呲牙],2023-03-22 16:27:41,4,0
回复 @Miracle诺言 :英伟达昨天说他要做,2023-03-23 03:52:01,1,0
